{
 "schema": "qor-receipt/v0",
 "match": {
  "match_id": "32b29a8a383c4849",
  "game": "madden27",
  "platform": "ps5",
  "scorebug_profile": "madden27_standard",
  "mode": "dual",
  "started_ms": 1790000000000,
  "ended_ms": 1790000375500
 },
 "result": {
  "home_score": 24,
  "away_score": 17,
  "quarter": 4,
  "final_t_ms": 1790000374500,
  "winner": "home",
  "method": "agreed_scorebug_final"
 },
 "players": [
  {
   "role": "away",
   "player_id": "psn:away_player",
   "pubkey": "231a497bf5e0ac181667c9b58d68c8d53ecc6d8fb510bc03a41abeda35bfc154",
   "key_kind": "software"
  },
  {
   "role": "home",
   "player_id": "psn:home_player",
   "pubkey": "dcd2122c46074185dc50059ba627b9999445fa3fbd60d8c988fd0b30f4a12a9a",
   "key_kind": "software"
  }
 ],
 "referee": {
  "pubkey": "07c869133a9f4eb9c0ea100f56bd3e94323fc39d6dc38a171359087f765e0678",
  "key_id": "eea59fba043ca5fe",
  "key_kind": "software"
 },
 "challenges": [
  {
   "id": "5f75ca4d66fa",
   "role": "home",
   "phase": "kickoff",
   "nonce": "b372553f0412868e113d6f7ba3e31047",
   "pattern": [
    "OPTIONS",
    "CIRCLE",
    "LEFT",
    "UP",
    "TRIANGLE"
   ],
   "issued_ms": 1790000001000,
   "deadline_ms": 1790000021000,
   "result": {
    "ok": true,
    "reason": "ok",
    "pause_press_ms": 1790000002500,
    "done_ms": 1790000003700,
    "latency_ms": 120,
    "hid_sha256": "16426a5a3b47722f4df81a06edeba784b90ea464d7020e0ac46864781f6bba2e"
   }
  },
  {
   "id": "aaf194f1e676",
   "role": "away",
   "phase": "kickoff",
   "nonce": "12ec789e72f3535483540526c5887584",
   "pattern": [
    "OPTIONS",
    "UP",
    "DOWN",
    "SQUARE",
    "TRIANGLE"
   ],
   "issued_ms": 1790000001000,
   "deadline_ms": 1790000021000,
   "result": {
    "ok": true,
    "reason": "ok",
    "pause_press_ms": 1790000002500,
    "done_ms": 1790000003700,
    "latency_ms": 120,
    "hid_sha256": "89cad6b0b3b0ba67cba6900ce9a42ce743be8dfc02004f0ef3cd78fcedf74496"
   }
  },
  {
   "id": "236163cff62d",
   "role": "away",
   "phase": "halftime",
   "nonce": "9f412562f3cad297b08a54569b86d09f",
   "pattern": [
    "OPTIONS",
    "DOWN",
    "LEFT",
    "CIRCLE",
    "SQUARE"
   ],
   "issued_ms": 1790000150000,
   "deadline_ms": 1790000170000,
   "result": {
    "ok": true,
    "reason": "ok",
    "pause_press_ms": 1790000151500,
    "done_ms": 1790000152700,
    "latency_ms": 120,
    "hid_sha256": "23d8dffb1a28bd1c418b94f8a95d623680306df646c67e1a54e1c598e0603b73"
   }
  },
  {
   "id": "b4a42da02616",
   "role": "home",
   "phase": "halftime",
   "nonce": "31879f15dab60cea39fba2781daaecf1",
   "pattern": [
    "OPTIONS",
    "RIGHT",
    "LEFT",
    "RIGHT",
    "CIRCLE"
   ],
   "issued_ms": 1790000150000,
   "deadline_ms": 1790000170000,
   "result": {
    "ok": true,
    "reason": "ok",
    "pause_press_ms": 1790000151500,
    "done_ms": 1790000152700,
    "latency_ms": 120,
    "hid_sha256": "be8c14856132018b17b8a768d86eb98e1aa2000381d25295ac3e76e3eb959db8"
   }
  },
  {
   "id": "aee956223af9",
   "role": "away",
   "phase": "end",
   "nonce": "09eb0218f936c4341ac4f83d306ae3b5",
   "pattern": [
    "OPTIONS",
    "RIGHT",
    "SQUARE",
    "LEFT",
    "CROSS"
   ],
   "issued_ms": 1790000371500,
   "deadline_ms": 1790000391500,
   "result": {
    "ok": true,
    "reason": "ok",
    "pause_press_ms": 1790000373000,
    "done_ms": 1790000374200,
    "latency_ms": 120,
    "hid_sha256": "97277bc6591042f7922308ce35843d74ec20f2d4d4509da066fd769b6bd29849"
   }
  },
  {
   "id": "eef034218f68",
   "role": "home",
   "phase": "end",
   "nonce": "24fd3d161263db1b16a657bb82ce9bc0",
   "pattern": [
    "OPTIONS",
    "CROSS",
    "DOWN",
    "CIRCLE",
    "SQUARE"
   ],
   "issued_ms": 1790000371500,
   "deadline_ms": 1790000391500,
   "result": {
    "ok": true,
    "reason": "ok",
    "pause_press_ms": 1790000373000,
    "done_ms": 1790000374200,
    "latency_ms": 120,
    "hid_sha256": "4d2dcc962e311617a904bfea415d7060183df8873b74a8bac4aa535cbee03f72"
   }
  }
 ],
 "checkpoints": {
  "home": [
   {
    "seq": 0,
    "t_ms": 1790000004000,
    "frames_hash": "24dc8d8448ebd1760b72aa7e4307a2dbf7943e75fd8a4ffd254af21037d3ec39",
    "input_hash": "05a9f7abe5ced69446eab9d3ca124d7f37ef127d473a6c2586a3db2031eb6e30",
    "prev": "0000000000000000000000000000000000000000000000000000000000000000",
    "hash": "fe897041b7c4abd05f512fef25e5a3d22133b1d0c11fa34f381ece319908c958",
    "referee_ts_ms": 1790000004000,
    "referee_sig": "c58e2e266700519bb08232e6e7a2569dedd9c7cb568258e16b689c5f16d9c629f42a2c67d94be4546ee94f190befc0e9397ba61ca7c55567284933cb03cf320b"
   },
   {
    "seq": 1,
    "t_ms": 1790000008000,
    "frames_hash": "6130462518aaa5423a9316cce2781fcfe1a8465b1439ebab471f6bc7e73687cd",
    "input_hash": "115c064a5ed9d97d099f735ac9749af27239dc464098f6e721a344323ddaae77",
    "prev": "fe897041b7c4abd05f512fef25e5a3d22133b1d0c11fa34f381ece319908c958",
    "hash": "9a7f2cbceab868018992b2e4e2cbb5e3460b3251755ea1dc230c0bfa946ab8db",
    "referee_ts_ms": 1790000008000,
    "referee_sig": "b41777b95b007432f44cfa103b4d74d1e4b49f7f075f3235b1ace8218d72c9f4d64da07c30331aff5fe4b32b0b33deb6276bacd3da6604d87fb6a30992b2be0f"
   },
   {
    "seq": 2,
    "t_ms": 1790000012000,
    "frames_hash": "921fec67d70393cba1e400657b20bebfadbcff2c5d4249bb21dbed788e8e4bcc",
    "input_hash": "8118ec2d0d3681a388657c8960bf48ae05ea95b0fdf150a3e0836b9102d406a2",
    "prev": "9a7f2cbceab868018992b2e4e2cbb5e3460b3251755ea1dc230c0bfa946ab8db",
    "hash": "76cf5bbe86d2817d81ef3134d95f67fcadc42fc0512a99bb4fe33595a71428f0",
    "referee_ts_ms": 1790000012000,
    "referee_sig": "afff44d605346d292edcbdd900f60aed7efd142b3ea77bef58fe2b5d206491e4f5bfa1a43e1a6139f8b63b7b9ea8000e26eec0c8105854aca249ad914b69780e"
   },
   {
    "seq": 3,
    "t_ms": 1790000016000,
    "frames_hash": "a0b97a906b844b1de5e3ae2b1c688aa9b29aa8d3de11276436b21688353b6c22",
    "input_hash": "f1953049cdc2a227c39ca55699fcf378e7ffa1a50d03aca86cf7c2ba1b3f5e57",
    "prev": "76cf5bbe86d2817d81ef3134d95f67fcadc42fc0512a99bb4fe33595a71428f0",
    "hash": "ff441d87347b9c02dacddebbc6d58d603fe62d8eaa665e195457a63698bcf2e4",
    "referee_ts_ms": 1790000016000,
    "referee_sig": "0595f50ec44d2672722c34f88a3029badd50ff340fe98b89aaac37c7656942f2a5097921840fe6cb19c524f68f28e57675bb2a5bdb8e720309bcc390abaaaf09"
   },
   {
    "seq": 4,
    "t_ms": 1790000020000,
    "frames_hash": "3bd777711632c2867339eb06a90778487d97a06d2146e20dfaf590f7fd908971",
    "input_hash": "95f2d52e9b5a5863da0858de8144a942c956fa91500fc4030bbd2750e6d9b380",
    "prev": "ff441d87347b9c02dacddebbc6d58d603fe62d8eaa665e195457a63698bcf2e4",
    "hash": "2d0bfb1b877f1608ddcf0cac3d7674f259219e442867a33f7da0574acd6643c1",
    "referee_ts_ms": 1790000020000,
    "referee_sig": "ebc1f0ce9f25928ffeebecbb45d5d0474bc3a97c8b437d66495c8e00a38ab306536bf0acae9eeef47166a54b95773ffec53e562611c7a6e0a22201a40b550f08"
   },
   {
    "seq": 5,
    "t_ms": 1790000024000,
    "frames_hash": "15387a0d2bca2bf214aaad602df2037fb9a7a785641685ef5a4d3c7a7a51c041",
    "input_hash": "1637a1ac5bba83e3e0d8394902e212d8a820f8f9a4f9250366ea5573c714414f",
    "prev": "2d0bfb1b877f1608ddcf0cac3d7674f259219e442867a33f7da0574acd6643c1",
    "hash": "66846cc42638d9da94db51fc24827532805085167d4f446a51b013176a3c79ef",
    "referee_ts_ms": 1790000024000,
    "referee_sig": "9082402dadf30847da11038f550a5873417e49e70e5720dea8e168660c0a67aabe5e0082b812821e2b69fd270fe4f7253927a4281ef63ce097a54a67123dd505"
   },
   {
    "seq": 6,
    "t_ms": 1790000028000,
    "frames_hash": "d883581d1f55d9340d674e20b0b32c12c2f6be097d62a1f6670a4921b47b26a9",
    "input_hash": "ef8302e0aab98dbaaf4283373ea6d39f03f766675a418725a3ce3770807496b2",
    "prev": "66846cc42638d9da94db51fc24827532805085167d4f446a51b013176a3c79ef",
    "hash": "b858812bcf96cfca11ccf610d3bfa736d6370698424c1959273543b07882fe01",
    "referee_ts_ms": 1790000028000,
    "referee_sig": "2de2dfc2bdf2ef35b9ef247e1d21dbfcf5664c42005c1574f853075e389282e6cd9538a59c25fce5153f2b2ae764ab5351b38e92b1f62702742a42b387fe0c0a"
   },
   {
    "seq": 7,
    "t_ms": 1790000032000,
    "frames_hash": "46afbb8bc4b6bbbfbf7648feeef3de03ead134734b0697a05aa3630d821193a6",
    "input_hash": "f59161716260510831e0690abfe66e0a8b9b4268be04d7828c96e8039b0a7807",
    "prev": "b858812bcf96cfca11ccf610d3bfa736d6370698424c1959273543b07882fe01",
    "hash": "91a31c7c70d9900f5bb98c97b3732402540a7a23c49551520a264b2209c46a16",
    "referee_ts_ms": 1790000032000,
    "referee_sig": "1eeaf477a6eec4ba6421385bd89a3dde179aa586e289a070cdf57c3e3a982c20c20e61d494feeb2fd467e381ae57df924798b2b2344e1a29cfcd86ebbc6e6409"
   },
   {
    "seq": 8,
    "t_ms": 1790000036000,
    "frames_hash": "a7a92229b55298bfd0f56d615e289e994de09d1c89439e94fc70beed35cf2e5c",
    "input_hash": "8549ac381820062e2e717f11d081616af920a3cacf90e94410f1c8ef975ac68a",
    "prev": "91a31c7c70d9900f5bb98c97b3732402540a7a23c49551520a264b2209c46a16",
    "hash": "7f8f21840da360090a2e067b18de7028832efb1fcfd7de4db1eb75f54cf1c8b5",
    "referee_ts_ms": 1790000036000,
    "referee_sig": "7847cfd1196ec7b3ea4cf1629fbd8d8b55cd2a3cc7d2273e36787a1686b62b67614d70039ca19ecb5b0e146b1e1525041cfaedc73481355240bf1f9beac7800b"
   },
   {
    "seq": 9,
    "t_ms": 1790000040000,
    "frames_hash": "140a34c6398f82ba01aaf7791a7fa043da2c3c152ed0277d3eb4df6688fd9df1",
    "input_hash": "63f5bee96952dfc1876d637d7500064de46271d1e612aabd43e2449f7e130412",
    "prev": "7f8f21840da360090a2e067b18de7028832efb1fcfd7de4db1eb75f54cf1c8b5",
    "hash": "0c3d0b696fe164ca32b12114ce931dd6f26a25cbad6acb0f5a89adfa7eb540cf",
    "referee_ts_ms": 1790000040000,
    "referee_sig": "656f5fa52362a9683ccbf52f9e85fc48c854bc40185b75b441e6caf499e93cad6ec4db7f66aa0958655e96522deb4e1f91c043ab29e78ec53bece8b8cd0ac605"
   },
   {
    "seq": 10,
    "t_ms": 1790000044000,
    "frames_hash": "9d7ba0108d66a20821c05c76468ba00b90cec49b61b52f744c24afe28f142fe4",
    "input_hash": "b3dd5bbaf198138685bbfc959147cb4dddc626252b9efb11cbe98ed4e40aadf5",